"awardnum","award","awardpoints","location","datevalue","genus","species","clone","crossvalue","exhibitor","photographer","awardphoto","nsnum","nsvnum","dswnum","dslnum","petwnum","petlnum","lipwnum","liplnum","lswnum","lslnum","numflwrs","numbuds","numinfl","measurementtype","inflen","plantW","plantH","description"
20225418,"AM","82","Sonoma County Orchid Society Show","March 26, 2022","Cattleya","intermedia v. orlata","goodstuff","species","Tom Pickford","Ken Jacobsen","None","12.1","12.0","2.3","7.4","2.6","6.4","4.0","5.1","2.7","5.5","9","0","2",1,"NA","NA","NA","Nine flowers on two 25-cm inflorescences; sepals and petals white blushed lavender, petals darker at lateral margins; lip white, blushed lavender, midlobe magenta, side lobes magenta at the distal margin; column blushed lavender; pollen cap pale yellow; substance firm; texture crystalline"
20162292,"AM","80","Peninsula Orchid Society Show","January 22, 2016","Rhynchostele","Vexativa","Mr. Spot","(Rhynchostele cordata x Rhynchostele aptera)","Neal Winslow","None","20162292.jpg","10.0","8.8","1.6","5.1","2.0","4.9","2.5","4.4","1.2","7.2","6","0","1",1,"NA","NA","NA","Six well spaced flowers on one inflorescence; sepals yellow with heavily coalesced cordovan spots; petals light yellow with coalesced cordovan spots; side-lobes orange, spaded midlobe white with coalesced cordovan spots, margins fringed cordovan; column white;  substance firm; texture matte."
20185580,"HCC","77","Oakland","October 15, 2018","Paphiopedilum","Hawaiian Peacock","Slipper Zone Jacob's Coat","(Paphiopedilum Hawaiian Illusion x Paphiopedilum Petula's Peacock)","Lehua Orchids","None","20185580.jpg","9.5","7.4","5.3","4.9","2.1","6.2","3.0","5.0","2.8","3.7","1","0","1",0,"NA","NA","NA","One flower on one inflorescence; dorsal sepal chartreuse, maroon veins, off-white margin distally; synsepal green, maroon veins; petals chartreuse overlaid dark maroon, dark purple spots centrally, hirsuite edges; pouch dark maroon; staminode chartreuse overlaid maroon;  substance average; texture glossy."
20185553,"AM","82","Peninsula Orchid Society Show","January 26, 2018","Lycaste","Chita Impluse","Cotton Tail","(Lycaste Chita Melody x Lycaste Alan Salzman)","Cal Orchid","None","20185553.jpg","14.4","12.0","5.8","7.5","4.0","4.6","2.1","3.8","5.9","7.5","1","0","1",1,"NA","NA","NA","One full flat flower on one inflorescence; sepals cream, heavily overlaid pink centrally to green distal tips, creating charming halo effect at base of segments; petals white, suffused rose-pink distally to recurved margins; lip white, yellow blush in throat, side lobes blushed pink; substance firm; texture matte."
20152369,"AM","80","Peninsula Orchid Society Meeting","August 28, 2015","Bulbophyllum","fascinator","Gilbert","species","Carol Zoltowski","None","20152369.jpg","1.6","19.5","1.4","3.1","0.7","2.0","0.7","2.0","2.6","15.5","5","0","5",1,"NA","NA","NA","Five flowers on five inflorescences; flower base color chartreuse; dorsal sepal striped dark burgundy centrally, hirsute margins; lateral sepals heavily overlaid intense burgundy, fading to green distally, tips twisted; petals thin burgundy stripes, hirsute marginally; lip hinged, intense burgundy; substance firm; texture pebbled."
20235371,"HCC","77","Sonoma County Orchid Society Show","April 1, 2023","Paphiopedilum","venustum","Inner Fire","species","Japheth Ko","Lynne Murrell","20235371.jpg","8.7","6.5","3.0","3.0","1.7","4.1","2.5","3.5","None","None","1","0","1",0,"NA","NA","NA","One flat flower on one 9.5-cm inflorescence; sepals white veined green; petals slightly undulate, white heavily veined green, burgundy line midrib fading to spots proximally, overlaid rose distally, margins hirsuite, raised bugundy spots proximal half; pouch yellow-green overlaid dark rose, heavily veined dark green; staminode green; substance medium; texture waxy."
20185414,"AM","81","San Francisco","August 7, 2018","Habenaria","erichmichelii (syn. rhodocheila subsp. rhodocheila)","Memoria Theresa Wik","species","Jim Heilig","None","20185414.jpg","2.9","3.5","0.7","1.5","NM","NM","2.2","2.8","0.2","1.2","25","6","4",1,"NA","NA","NA","Twenty-five flowers and six buds on four infloresences, plus two immature infloresences; sepals rose-tan; petals intense orange-rose; lip intense orange-rose basally, light pink elsewhere, faint orange-rose picotee, nectary rose-tan, 5.0cm long; substance firm; texture matte. Plant entered as Habenaria erichmichelii."
20152321,"AM","85","San Francisco","August 4, 2015","Bulbophyllum","fritillariiflorum","Gilbert","species","Carol Zoltowski","None","20152321.jpg","4.2","8.6","4.2","9.4","NM","NM","NM","NM","6.2","7.0","1","0","1",1,"NA","NA","NA","One well-presented flower on one inflorescence; dorsal sepal light green overlaid with dark green and maroon mosaic pattern; synsepal light green fading to rose to cream distally, overlaid with reticulation dark green fading to maroon distally; petals tiny and pale yellow with maroon apex; lip hinged, light green overlaid with maroon spots; anther cap yellow; substance firm; texture crystalline."
20235279,"HCC","78","Filoli Historic House","April 15, 2023","Cattleya","intermedia v. aquinii alba","Genesio","species","Amy and Ken Jacobsen","Chaunie Langland","20235279.jpg","9.5","9.4","2.0","5.9","3.0","5.5","2.9","4.7","2.2","5.6","12","0","2",1,"NA","NA","NA","Twelve flowers on two up to 12-cm inflorescences; flowers white; sepal tips green; petals ruffled, midrib blushed pale green; lip ruffled, pale green blush centrally; substance firm; texture diamond dust."
20174106,"CCM","85","San Francisco","December 5, 2017","Laelia","albida","Winston","species","Ken and Amy Jacobsen","None","20174106.jpg","6.5","5.5","1.3","3.5","1.0","3.9","1.6","2.8","1.9","3.3","160","18","22",1,"NA","NA","NA","One hundred sixty flowers and 18 buds on 22 upright 38-cm inflorescences; 50 x 60-cm plant growing in a 23-cm plastic pot; sepals white blushed pale pink; petals white; lip white, throat dark maroon striations, yellow central callus,  pink distally; substance firm; texture satin.  Reference award #20174105."
20185554,"CCM","83","Peninsula Orchid Society Show","January 26, 2018","Pleurothallis","truncata","Boo-Boo","species","Masaki Asuka","None","20185554.jpg","0.3","0.2","0.1","0.1","NM","NM","NM","NM","NM","NM","4600","0","92",1,"NA","NA","NA","Approximately 4600 flowers on 92 inflorescences; on an 80-cm x 80-cm plant grown in a 24-cm plastic pot; flowers concolor orange; dorsal sepal formed a lid over succate connate lateral sepals; column yellow; substance firm; texture matte."
20225402,"HCC","78","Pacific Orchid Exposition","February 24, 2022","Paphiopedilum","Magically Fred","Claire","(Paphiopedilum President Fred x Paphiopedilum Magically Wood)","Dawn Dawson","Ken Jacobsen","20225402.jpg","13.8","10.8","6.8","6.2","3.0","1.5","3.5","7.0","3.2","5.5","1","0","1",0,"NA","NA","NA","One symmetrical flower on one 23.2-cm inflorescence; arising from a 3-growth 21.5-cm plant; sepals white overlaid green centrally, rose suffused marginally, venation green; petals white, basally green, distally rose, veining cordovan, random deep mahogany raised spots, superior margins hirsute; pouch maroon, veining darker maroon; staminode light green, dark green centrally; substance firm; texture glossy."
20174138,"AM","83","San Francisco","August 1, 2017","Dendrobium","cuthbertsonii","Candy Cane","species","Golden Gate Orchids","None","20174138.jpg","3.0","3.8","1.4","3.8","1.3","1.6","0.6","2.3","1.7","4.4","6","0","6 ",1,"NA","NA","NA","Six flowers on six inflorescences; sepals and petals deep fuchsia, white distally; lip deep fuchsia, dark orange edge, striated black band on margin, interior orange; substance heavy; texture crystalline."
20152306,"HCC","78","Peninsula Orchid Society Meeting","July 24, 2015","Sobralia","xantholeuca","Ohsuka","species","Masaki Asuka","None","20152306.jpg","10.8","11.8","2.4","8.9","3.1","8.2","5.2","7.2","2.6","8.0","4","3","7",1,"NA","NA","NA","Four flowers and three buds on seven inflorescences; sepals and petals yellow; lip yellow, throat orange; substance firm; texture matte."
20194886,"AM","80","Filoli Historic House","November 16, 2019","Paphiopedilum","Fred's Magical Bean","Slipperzone Bright Glow","(Paphiopedilum Fred's Moon 'Lehua's Glow' x Paphiopedilum Fred's Magic 'Lightly Peppered')","Lehua Orchids","None","20194886.jpg","11.9","8.2","5.8","4.9","3.0","6.2","2.7","5.8","3.7","4.3","1","1","1",0,"NA","NA","NA","One flower and one bud on one cut inflorescence; dorsal sepal and synsepal cream, striped bright green; petals cream, striped and flushed green basally, flushed light maroon distally, small dark maroon spots overall; pouch green, flushed and veined dark maroon; staminode cream, veined green centrally, flushed maroon edge; substance moderate; texture matte; slight damage in transit."
20205301,"AM","83","Pacific Orchid Exposition","February 20, 2020","Masdevallia","Bay Breeze","Red Velvet","(Masdevallia Fraseri x Masdevallia John Tomaschke)","John Leathers","None","20205301.jpg","3.2","9.7","1.9","6.8","NM","NM","NM","NM","2.4","6.3","1","0","1",1,"NA","NA","NA","One flower on one upright inflorescence; dorsal sepal light yellow, lightly overlaid red, deep red veins and cauda; lateral sepals red, deep red veins and caudae; petals deep red; lip deep red; substance heavy; texture velvety."
20235281,"AM","84","Filoli Historic House","April 15, 2023","Masdevallia","Red Flamingo","Jane Hsu Bao","(Masdevallia Rubicon x Masdevallia coccinea)","Paul and Phyllis Chim","Chaunie Langland","20235281.jpg","4.9","9.1","0.2","4.9","0.1","0.1","0.1","0.1","2.8","5.2","1","1","2",1,"NA","NA","NA","One full flower and one bud on two up to 32-cm inflorescences; sepals bright magenta, dark magenta venation, dorsal cauda magenta, red-brown tips all caudae; minute petals white; minute lip white tipped yellow; substance firm; texture velvet."
20255351,"AM","85","San Francisco","January 7, 2025","Cymbidium","goeringii","Taiwan Native #101","species","Amy and Ken Jacobsen","Ken Jacobsen","20255351.jpg","7.2","7.8","1.3","4.2","1.4","3.1","1.0","1.4","1.2","4.3","2","0","2",1,"NA","NA","NA","Two well-balance fragrant flowers on two up-to 15-cm inflorescences; sepals lanceolate, pale green blushed pink distally, lightly veined pink; petals porrect, cream veined pink, heavily marked maroon medially; lip recurved, white spotted maroon; substance firm; texture matte."
20185567,"HCC","77","Oakland","March 19, 2018","Paphiopedilum","liemianum","Margaret Ann","species","Margaret and Terry Boomer","None","20185567.jpg","9.5","7.7","4.4","3.8","1.1","4.2","2.7","5.9","4.0","3.2","1","1","1",0,"NA","NA","NA","One flower and one bud on one 13.5-cm inflorescence; dorsal sepal cream overlaid green centrally, bronze veins lower third, 0.6-cm cream margin; synsepal green; petals light green barred magenta, margins undulate, hirsute; pouch cream overlaid mauve increasing intensity from top to bottom; substance firm; texture matte."
20225310,"AM","82","Filoli Historic House Monthly","March 19, 2022","Dendrobium","kingianum","Black Snake","species","Amy and Ken Jacobsen","Ken Jacobsen","None","3.0","2.9","0.7","1.8","0.5","1.6","0.9","1.4","1.0","2.0","6","17","3",1,"NA","NA","NA","Six slightly cupped flowers and 17 buds on three upright to arching inflorescences measuring up to 12.5cm long; sepals and petals vibrant electric purple; lip half-tubular, white, dark purple overlay; column white; substance firm; texture slightly waxy."
20194812,"HCC","79","San Francisco","June 4, 2019","Bulbophyllum","trachyanthum","Petaluma","species","Judy Carney","None","20194812.jpg","0.8","12.0","0.9","7.7","NM","1.8","0.1","0.5","0.9","5.8","62","19","81",1,"NA","NA","NA","Sixty-two flowers and 19 buds on 81 inflorescences, typical infloresence 17cm; well-grown 63-cm diameter plant in a wooden basket; dorsal sepal burgundy, white tesselation proximally; lateral sepals burgundy, dusted white, fading to white distally; petals burgundy, whisker-like, projecting forward; lip green;  substance soft; texture matte;  also recieved award# 20194813."
20235293,"AM","80","Filoli Historic House","June 17, 2023","Procatavola","Key Lime Stars","Bayou Moon","(Cattlechea Lime Sherbet x Brassavola nodosa)","Mitch Schneider","Chaunie Langland","20235293.jpg","13.6","12.9","1.0","7.7","0.8","6.6","3.1","8.4","1.0","7.2","3","0","1",1,"NA","NA","NA","Three stellate flowers on one 10-cm upright inflorescence; sepals and pteals lanceolate, bright lime green; lip tubular bell, pale yellow-green, throat bright lime green spotted burgundy; column lime green, white apically, anther cap yellow overlaid green; substance firm; texture waxy."
20245288,"HCC","79","Filoli Historic House","June 15, 2024","Cattleya","praestans","Solana","species","Geoff Harris","Chaunie Langland","20245288.jpg","10.0","9.5","1.9","5.6","4.0","5.0","2.6","5.0","1.8","5.4","1","0","1",1,"NA","NA","NA","One flower on one 2.7-cm inflorescence; dorsal sepal and petals slightly reflexed, sepals and petals bold purple; lip closed and crossed over column, dark magenta, vibrant magenta apically; substance medium; texture crystalline."
20152294,"HCC","78","Peninsula Orchid Society Show","January 23, 2015","Cymbidium","Ha Bui","Ark","(Cymbidium Len Southward x Cymbidium Rose Armstrong)","Terry and Margaret Boomer","None","20152294.jpg","7.1","6.1","2.6","3.8","1.9","3.9","1.9","2.8","2.6","3.8","22","0","1 ",1,"NA","NA","NA","Twenty-two flowers on one arched inflorescence; sepals and petals light green; lip pale green-yellow, sparsely speckled light cordovan at apex; substance firm; texture matte."
20185568,"HCC","78","Oakland","March 19, 2018","Cymbidium","Kuranda","Lil Stinker","(Cymbidium madidum x Cymbidium suave)","Margaret and Terry Boomer","None","20185568.jpg","2.9","3.0","0.8","1.9","0.7","1.8","0.7","1.6","0.7","1.8","354","38","6",1,"NA","NA","NA","Three hundred fifty-four flowers and 38 buds on six inflorescences; sepals and petals chartreuse; lip proximal third oxblood, distal two-thirds chartreuse; substance firm; texture matte."
20185450,"CCM","89","Sonoma County Orchid Society Show","March 31, 2018","Dendrobium","kingianum","T. R. Samara","species","Masaki Asuka","None","20185450.jpg","3.8","2.8","0.5","1.6","0.6","1.6","0.8","1.1","1.0","2.0","159","160","40",1,"NA","NA","NA","One hundred fifty-nine flowers and 160 buds on 40 inflorescences; grown in a 20-cm clay pot; sepals and petals rich vibrant purple, lighter basally; lip white heavily overlaid rich purple, narrow margin white, white centrally; substance heavy; texture matte."
20235263,"HCC","78","Filoli","February 18, 2023","Cymbidium","Sylvia Darr","Dancing Spiders","(Cymbidium Pinata Magic 'Stirling' x Cymbidium erythraeum 'Paradise')","Pierre Pujol","Chaunie Langland","20235263.jpg","7.9","6.2","2.0","4.6","1.2","4.2","2.1","2.8","1.8","4.6","39","2","5",1,"NA","NA","NA","Thirty-nine flowers and two buds on five arching to pendulous inflorescences; dorsal sepal hooded, yellow heavily ovelaid and blotched dark brown-burgundy; lateral sepals lanceolate, yellow, very heavily ovelaid and blotched dark brown-burgundy; petals lanceolate, reflexed, yellow very heavily ovelaid and blotched dark brown-burgundy coalescing centrally; lip pale yellow, blotched dark burgundy; column light yellow spotted burgundy, overlaid burgundy distally, anther cap cream;  substance firm; texture matte."
20194717,"Show Trophy","84","Pacific Orchid Exposition","February 21, 2019","Display","'Orchids of the Enchanted Forest'","NA","(<A HREF=""../index.html"">home</A>)</CENTER>","San Francisco Orchid Society","None","20194717.jpg","NA","NA","NA","NA","NA","NA","NA","NA","NA","NA","NA","NA","NA",1,"NA","NA","NA","An island of display at the show entrance, plants grown by many members of the San Francisco Orchid Society, comprised of a wide variety of orchid genera; large, well-grown specimen size cymbidiums and dendrobiums were the focal point of the display, surrounded by paphiopedilums, phragmipediums, cattleyas, rossioglossums, and may other genera, against a backdrop of a pine tree, with white phalaenopsis placed throughout the display to draw the eye from point to point; a unicorn and a tall mushroom with a giant dragon fly showcased the theme of the show: Orchids of the Enchanted Forest."
20215330,"HCC","77","Peninsula Orchid Society Show","August 8, 2021","Dendrobium","Eltonense","Cavalier","(Dendrobium victoria-reginae x Dendrobium papilio)","Jason Douglass and Ron Norris","None","20215330.jpg","6.5","5.4","2.0","4.0","2.0","4.2","2.5","5.0","2.2","4.0","10","0","None",1,"NA","NA","NA","Ten flowers on two 43-cm canes; sepals and petals lavender, white proixmal end, darker lavender veins, white spot distally; lip flat, white proximally, prominent purple veins, white spot distally; column white; substance firm; texture crystalline."
20152349,"AM","87","Pacific Orchid Exposition","February 19, 2015","Masdevallia","veitchiana","Titan","species","John Leathers","None","20152349.jpg","5.3","17.7","3.4","9.0","NM","NM","0.5","1.0","2.9","9.0","1","0","1",1,"NA","NA","NA","One full flower on one arching inflorescence; sepals vibrant orange, hirsute magenta, concentrated proximally on dorsal sepal, coalesced to vertical stripes; petals white; lip black; substance heavy; texture matte."
20225352,"AM","83","Filoli Historic House","November 19, 2022","Rhyncattleanthe","Angel Voice","Gracie","(Rhyncattleanthe Shinfong Little Love x Cattleya coccinea)","Amy and Ken Jacobsen","Chaunie Langland","20225352.jpg","6.7","6.4","2.0","3.8","2.8","3.3","1.8","2.8","1.8","3.4","3","0","1",1,"NA","NA","NA","Three flowers well-presented on one upright 5.0-cm inflorescence; sepals and petals bright yellow heavily overlaid scarlet, petals transition to bright yellow proximally; lip bright yellow, distal margin bright scarlet; substance very firm; texture crystalline."
20245306,"CCM","85","Filoli Historic House","December 21, 2024","Aerangis","Lindsay","Kevin C. Walters","(Aerangis leuteoalba v. rhodosticta x Aerangis hyaloides)","Jim Heilig","Chaunie Langland","20245306.jpg","2.0","2.0","0.3","1.0","0.3","1.1","0.6","1.1","0.3","0.9","425","25","25",1,"NA","NA","NA","Approxiamately four hundred twenty-five flowers and 25 buds on 25 left-sweeping up-to 26-cm inflorescences; incredibly well-grown, immaculate, very compact plant, 22 cm wide, 15 cm tall, 16-cm hardwood branch mount; flowers white; sepals and petals lanceolate; lip spatulate, spur 1.8 cm; column and anther cap bright yellow; substance medium; texture diamond dust."
20245279,"HCC","79","Peninsula Orchid Society and Gold Coast Cymbidium Society Show","April 27, 2024","Cattleya","intermedia v. coerulea orlata","Awesome","species","Amy and Ken Jacobsen","Chaunie Langland","20245279.jpg","10.9","10.5","1.6","6.2","1.9","5.5","3.5","4.5","1.8","4.8","100","7","21",1,"NA","NA","NA","One hundred flowers on 18 up to 15-cm inflorescences and seven buds on three immature inflorescences; 91-cm x 50-cm plant grown in 34-cm plastic pot; sepals and petals lanceolate, white overlaid light mauve; lip tubular, white overlaid light mauve, dark purple distally; column white, anther cap white; substance firm; texture matte; also awarded #20245280 CCE."
20235297,"HCC","78","Filoli Historic House","July 15, 2023","Cattleya","x blossfeldiana","Estelle","(Cattleya rex x Cattleya luteola)","Steven Christoffersen","Chaunie Langland","20235297.jpg","7.2","8.1","1.4","6.2","2.1","5.3","2.8","4.2","1.5","5.2","11","0","1",1,"NA","NA","NA","Eleven slightly crowded flowers on one  9-cm inflorescence;  sepals recurve at tips, light yellow; petals forward, recurve at tips, light yellow; lip ruffled, light yellow, bright yellow throat overlaid maroon veins, white tip; substance medium; texture crystalline."
20215314,"AM","85","Filoli Historic House","May 15, 2021","Paphiopedilum","Magically Fred","Cherry Cordial","(Paphiopedilum President Fred x Paphiopedilum Magically Wood)","Dave Sorokowsky","None","20215314.jpg","12.3","9.8","7.0","5.9","3.3","6.9","3.2","4.9","3.3","4.1","1","0","1",0,"NA","NA","NA","One stately flat full flower on one sturdy 25.5-cm inflorescence; dorsal sepal white, veined green-brown, overlaid green basal half, transitioning to light burgundy on marginal two-thirds; synsepal green, burgundy stripes; petals green basal half transitioning to medium burgundy marginally, heavy dark mahogany warts, upper margin hirsute; pouch burgundy, veined darker burgundy; staminode pale green, darker green centrally; substance medium; texture waxy."
20215303,"HCC","75","Filoli Historic House","April 17, 2021","Cymbidium","Hazel's Dragon","Rose Cloud","(Cymbidium Hazel Tyers 'Santa Maria' x Cymbidium Satin Dragon 'Cinnabar')","Weegie Caughlan","None","20215303.jpg","10.2","9.8","5.8","7.5","4.9","6.9","5.0","5.0","5.0","7.3","11","0","1",1,"NA","NA","NA","Eleven full round flowers on one 76-cm inflorescence; sepals and petals white, blushed burgundy, burgundy speckles striated longitudinally; lip white, wide dark burgundy band distally, bugundy spots side lobes; column white overlaid burgundy, ventral surface spotted burgundy, anther cap cream; substance firm; texture matte."
20245381,"AM","85","San Francisco","July 2, 2024","Stanhopea","Bird of Prey","Poppers","(Stanhopea jenischiana x Stanhopea nigroviolacea)","Jim Heilig","Ken Jacobsen","20245381.jpg","12.5","12.5","3.0","7.8","2.2","7.5","4.4","7.2","5.6","8.2","5","0","1",1,"NA","NA","NA","Five flowers on one 18-cm pendent inflorescence and one immature inflorescence; sepals flat, rich yellow heavialy spotted cordovan; petals completely reflexed, rich yellow heavily spotted cordovan; hypochile rich yellow marked dark cordovan, 2.9 cm x 4.0 cm, epichile, 3.3 cm x 3.8 cm, and horns translucent ivory spotted cordovan; column green spotted cordovan, wings ivory spotted cordovan; anther cap yellow; substance very firm; texture matte, lip glossy."
20162310,"AM","86","Pacific Orchid Exposition","February 25, 2016","Masdevallia","Heathii","Volcano","(Masdevallia ignea x Masdevallia veitchiana)","John Leathers","None","20162310.jpg","5.8","12.9","2.7","9.0","0.2","0.4","NM","NM","2.9","7.2","3","4","7",1,"NA","NA","NA","Three erect flowers and four buds held high above foliage on seven 42-cm tall inflorescences, and five immature inflorescences; dorsal sepal orange, mid-vein dark red, caudae dark red; lateral sepals intense orange, vertical red lines convergent to solid red caudae; petals pale yellow;lip dark red; substance firm; texture velvety."
20194813,"CCM","88","San Francisco","June 4, 2019","Bulbophyllum","trachyanthum","Petaluma","species","Judy Carney","None","20194813.jpg","0.8","12.0","0.9","7.7","NM","1.8","0.1","0.5","0.9","5.8","62","19","81",1,"NA","NA","NA","Sixty-two flowers and 19 buds on 81 inflorescences, typical infloresence 17cm; well-grown 63-cm diameter plant in a 15-cm slatted wooden basket; dorsal sepal burgundy, white tesselation proximally; lateral sepals burgundy, dusted white, fading to white distally; petals burgundy, whisker-like, projecting forward; lip green;  substance soft; texture matte;  also recieved award# 20194812."
20235360,"AM","81","Pacific Orchid Exposition","February 23, 2023","Dracula","chestertonii","Quetzacoatl","species","John Leathers","Ken Jacobsen ","20235360.jpg","5.0","9.0","2.0","3.8","Minute","Minute","2.6","1.8","2.2","5.8","1","3","4",1,"NA","NA","NA","One flower, two mature buds and one juvenile bud on four pendent sequential-blooming 14-cm inflorescences;    sepals pale green heavily spotted purple, dorsal caudae pink-orange front, dark purple back, lateral caudae pale green transitioning to dark purple distally; petals minute, pink-orange; striking large lip light orange veined dark burgundy coalescing proximally; column cream finely spotted black-purple; substance firm; texture matte."
20152329,"CCM","83","Oakland","March 16, 2015","Dendrobium","linawianum","Republic of Taiwan","species","Japheth Ko","None","20152329.jpg","5.0","4.0","1.3","3.0","2.0","3.5","1.5","3.3","1.2","3.0","340","4","None",1,"NA","NA","NA","Three hundred forty flowers and four buds on twenty blooming canes on an immaculate, 70 x 55 cm plant growing in a 20 cm pot; sepals and petals white with purple suffusion distally; lip white with intense purple band distally, dark purple spots in throat; substance medium; texture matte."
20152310,"HCC","75","Santa Cruz Orchid Society Show","November 14, 2015","Cattleya","Tanya Lam","Bud Segraves","(Cattleya rupestris x Cattleya Coquina)","Tanya Lam","None","20152310.jpg","6.6","6.8","1.4","3.9","1.2","3.6","1.6","2.9","1.5","3.1","84","0","10",1,"NA","NA","NA","Eighty-four flowers on ten inflorescences well above 60cm tall plant; sepals and petals cream overlaid amethyst; lip light yellow basally, amethyst distally; substance firm; texture crystalline."
20245290,"HCC","77","Filoli Historic House","July 20, 2024","Phalaenopsis","equestris (Coerulea)","RoEm","species","Mary Bui-Pham","Chaunie Langland","20245290.jpg","2.7","2.9","0.7","1.2","0.7","1.2","0.9","1.1","0.8","1.3","12","67","3",1,"NA","NA","NA","Twelve flowers and 67 buds on three up to 30-cm branched inflorescences; dorsal sepal oblong, white faintly overlaid coerulea; lateral sepals ovate, white faintly overlaid coerulea; petals oblong, slightly porrect, white faintly overlaid coerulea; lip spatulate, white overlaid blue-lavender transitioning to yellow proximally, sidelobes narrow, upright, callus bright yellow spotted purple; column white overlaid coerulea, anther cap white; substance medium; texture crystalline."
