"awardnum","award","awardpoints","location","datevalue","genus","species","clone","crossvalue","exhibitor","photographer","awardphoto","nsnum","nsvnum","dswnum","dslnum","petwnum","petlnum","lipwnum","liplnum","lswnum","lslnum","numflwrs","numbuds","numinfl","measurementtype","inflen","plantW","plantH","description"
20174164,"AM","82","Orchid Society of California Show","May 13, 2017","Leptotes","bicolor","Fireworks","species","Jason Douglass","None","20174164.jpg","6.8","6.8","1.0","3.5","0.7","3.2","1.2","2.5","1.1","4.0","16","5","8",1,"NA","NA","NA","Sixteen flowers and five buds on eight inflorescences; sepals and petals white; lip white overlaid magenta proximally, side lobes light green; column broad, light green; substance medium; texture waxy."
20194879,"HCC","78","Filoli Historic House","July 20, 2019","Cattleya","tenebrosa","Bronze Belle","species","Amy and Ken Jacobsen","None","20194879.jpg","18.5","18.0","2.3","10.0","4.1","10.0","4.7","8.7","2.1","9.8","4","0","1",1,"NA","NA","NA","Four flowers on one 35-cm inflorescence; sepals and petals red-bronze, proximal margins recurved; lip pink, heavily overlaid magenta, margin undulate; substance firm; texture matte."
20235376,"AM","83","Santa Clara Valley OS Outreach","May 3, 2023","Sarcochilus","Kulnura Dragonfly","Sarah","(Sarcochilus Sweetheart x Sarcochilus Elegance)","Amy and Ken Jacobsen","Chaunie Langland","20235376.jpg","3.3","3.1","1.1","1.4","1.2","1.5","0.4","0.7","0.7","1.3","33","23","6",1,"NA","NA","NA","Thirty-three flowers and 23 buds held high above the foliage on six upright up-to 15.8-cm inflorescences; flowers white, spotted and blotched burgundy centrally, overlaid solid dark burgundy distally; lip overlaid yellow, orange markings; column cream; substance firm; texture crystalline."
20194827,"AM","82","San Francisco","October 1, 2019","Habenaria","Tanager","Charlevoix","(Habenaria xanthocheila x Habenaria rhodocheila)","Jim Heilig","None","20194827.jpg","2.8","3.4","1.1","1.1","0.1","0.3","2.8","2.8","0.7","1.2","14","4","1",1,"NA","NA","NA","Fourteen flowers and four buds on one inflorescence; dorsal sepal hooded, orange-brown exterior, orange interior; lateral sepals rolled, brown-orange; petals minute, brown; lip full, intense orange, mid-lobe bifurcate, 4.4-cm nectary intense orange; substance moderate; texture matte."
20245264,"HCC","76","Filoli Historic House","March 16, 2024","Cyrtorchis","chailluana","Iosco","species","Jim Heilig","Chaunie Langland","20245264.jpg","4.0","4.6","0.7","4.1","0.3","2.2","0.3","2.2","0.6","4.6","20","4","3",1,"NA","NA","NA","Twenty flowers and four buds on three up to 14.3-cm inflorescences; sepals and petals subulate, white, lateral sepals falcate; lip subulate, white, nectary 10.8 cm, light green; column and anther cap cream; substance firm; texture crystalline; noted for contrasting mahogany bracts subtending flowers."
20152327,"HCC","78","Oakland","February 16, 2015","Cymbidium","Ruby Turner","Sophia A. Lin","(Cymbidium Black Forest x Cymbidium Ruby Eyes)","Heather T. Drubus","None","20152327.jpg","6.0","4.6","2.5","3.9","1.8","3.8","2.5","3.1","2.3","3.8","22","6","3",1,"NA","NA","NA","Twenty-two flowers on two arched inflorescences and six buds on one immature inflorescence; sepals and petals dark red-brown; lip white, heavily overlaid similar dark red-brown but with much more red, arranged in strong pattern distally, prominent keels white, spotted red-brown and tinged with yellow; substance firm; texture matte."
20194880,"JC","NA","Filoli Historic House","August 17, 2019","Sarcochilus","Kulnura Taser","Sebastian","(Sarcochilus Need x Sarcochilus Kaleidoscope)","Kevin Hill","None","20194880.jpg","2.2","2.5","1.2","1.3","0.7","1.0","0.5","0.4","1.2","1.5","12","8","2",1,"NA","NA","NA","Twelve flowers and eight buds buds on 2  inflorescences; flat sepals cream, blotched maroon, becoming solid maroon apically; porect petals, cream, dark yellow bars, maroon edges; lip cream, side lobes overlaid dark maroon; substance firm; texture matte.  Commended for attractive apparent petal peloricism and potential for breeding."
20215327,"HCC","77","Filoli Historic House","July 17, 2021","Oncidium","Exeter Fireworks","Bentley","(Oncidium oliganthum x Oncidium tigrinum)","Amy and Ken Jacobsen","None","20215327.jpg","4.5","3.3","1.0","1.8","0.7","1.7","2.2","2.2","0.3","1.2","527","108","8",1,"NA","NA","NA","Five hundred twenty-seven ruffled flowers and 108 buds well displayed above the foliage on eight strong multi-branched inflorescences; well-grown plant in 25-cm bulb pan, clean foliage; sepals, pleasantly swept back, and petals bright yellow, barred mahogany; lip bright yellow, central calyx yellow, ridges red, side lobes barred mahogany; column and anther cap yellow; substance firm; texture glossy, lip matte; also received CCE, award #20215328."
20185570,"CCM","82","Gold Coast Cymbidium Growers Show","April 21, 2018","Cymbidium","Memoria Amelia Earhart","B52","(Cymbidium devonianum x Cymbidium Hazel Tyers)","Pierre Pujol","None","20185570.jpg","7.1","6.2","6.0","2.2","4.3","2.0","2.5","2.4","4.6","2.3","296","21","19",1,"NA","NA","NA","Two hundred ninety-six flowers and 21 buds on 19 inflorescences; on a 100-cm plant grown in a 20-cm pot; sepals and petals light yellow overlaid granulated pink; lip white, dark burgundy distally; substance firm; texture matte."
20194825,"HCC","77","San Francisco","October 1, 2019","Habenaria","Tanager","Cheboygan","(Habenaria xanthocheila x Habenaria rhodocheila)","Jim Heilig","None","20194825.jpg","2.5","3.2","1.2","1.1","0.1","0.3","2.5","2.7","0.4","1.2","13","8","1",1,"NA","NA","NA","Thirteen flowers and eight buds on one mature inflorescence plus one immature inflorescence; dorsal sepal hooded, pale green, edged orange; lateral sepals pale green; petals minute, brown; lip medium orange, mid-lobe bifurcate, 4.5-cm nectary medium orange; substance moderate; texture matte."
20235261,"AM","81","Filoli","February 18, 2023","Cymbidium","goeringii","Striped with Red","species","Amy and Ken Jacobsen","Chaunie Langland","20235261.jpg","8.1","6.8","1.2","4.5","1.4","3.2","0.9","2.2","1.2","4.8","1","0","1",1,"NA","NA","NA","One flat flower on one erect 9.5-cm inflorescence; sepals light green, blushed and striped rose; petals porrect, light green, blushed and striped burgundy; lip curled distally, cream, random burgundy spots; anther cap cream;  substance firm; texture satin."
20245270,"CCM","84","Sonoma County OS Show","March 23, 2024","Brassia","Rex","Waloma Spotless","species","Lynne Murrell","Lynne Murrell","20245270.jpg","13.4","25.5","1.0","11.9","0.8","7.3","5.0","5.9","1.0","14.0","43","3","4",1,"NA","NA","NA","Forty-three flowers and three buds on four up to 63.6-cm inflorescences; plant 82 cm x 52 cm in bark and perlite mix in 20-cm wide pot; sepals and petals lime green; lip pale green, callus gold; column lime green, anther cap pale green; substance heavy; texture crystalline."
20152328,"HCC","77","Malihini Orchid Society Show","March 6, 2015","Aerangis","citrata","Carol Weeks","species","Chaunie Langland","None","20152328.jpg","2.0","2.3","1.2","1.2","0.6","1.1","0.4","0.6","1.0","1.2","75","2","3",1,"NA","NA","NA","Seventy-five flowers and two buds on three gracefully arching inflorescences; sepals and petals light yellow-green; lip light yellow-green with white center; 3.0 cm spur pale-yellow;"
20235374,"HCC","77","San Francisco","April 4, 2023","Cymbidium","Little Flames","Woodside","(Cymbidium Fifi x Cymbidium Wallacia)","Pierre Pujol","Chaunie Langland","20235374.jpg","7.5","5.3","2.6","4.9","2.9","4.7","2.7","3.2","2.7","4.7","52","0","4",1,"NA","NA","NA","Fifty-two slightly cupped flowers on four up to 69-cm pendent inflorescences; sepals yellow, heavily brushed maroon apically; petals yellow, wide maroon medial stripe; lip yellow, white just below keels, anchor patterned red spots centrally; column yellow flushed maroon, anther cap cream; substance firm; texture matte."
20185477,"CCE","99","NCKU 87th Anniversary, Taiwan","November 12, 2018","Angraecum","giryamae","4N Nursery","species","4N Orchids","None","20185477.jpg","12.0","8.1","2.6","4.8","3.6","6.1","3.3","6.7","3.3","4.2","1","1","1",0,"NA","NA","NA","Phenomenal, exceptionally well-flowered, multi-crown specimen plant with 526 flowers and 130 buds on 65 inflorescences to 64cm long; plant 123cm tall, 195cm wide, 155cm deep in a 33cm tall, 90cm wide, 48cm deep slatted wooden basket; super-resupinate flowers typical of species; sepals and petals light green; lip white with 7.6cm spur; substance heavy; texture waxy."
20235280,"HCC","78","Filoli Historic House","April 15, 2023","Laeliocattleya","Canariensis","Memoria Andy Cameron","(Laelia anceps x Cattleya harpophylla)","Sylvia Darr","Chaunie Langland","20235280.jpg","9.2","9.7","1.5","5.8","2.8","5.5","2.4","3.1","1.5","4.9","17","0","5",1,"NA","NA","NA","Seventeen flowers on five upright inflorescences up to 34cm; sepals and petals lanceolate, golden orange-yellow; lip bright yellow, speckled burgundy basally; column yellow, anther cap white; substance firm; texture matte."
20245301,"CCM","86","Filoli Historic House","November 16, 2024","Cattleya","pumila","Fred","species","Amy and Ken Jacobsen","Chaunie Langland","20245301.jpg","9.0","9.0","2.3","5.0","4.0","5.0","2.4","4.9","2.0","5.0","16","0","16",1,"NA","NA","NA","Sixteen well-displayed, slightly cupped flowers on 16 up-to 11-cm inflorescences; plant 47 cm x 18 cm, grown in bark in a 20-cm plastic bulb pan; dorsal sepal upright to reflexed, intense fuchsia, white tips; lateral sepals tending toward porrect, intense fuchsia, white tips; petals full, ovate, slight ruffled margins, intense fuchsia; lip tubular, margin ruffled, intense violet distally, light spot center edge, throat light yellow; column pale green; substance moderate; texture crystalline."
20152360,"CHM","85","Pacific Orchid Exposition","February 19, 2015","Masdevallia","angulifera f. xanthina","Colomborquideas","species","Ron Parsons","None","20152360.jpg","1.6","2.8","1.0","2.8","NM","NM","NM","NM","1.0","2.3","13","0","13",1,"NA","NA","NA","Thirteen tubular flowers on thirteen erect inflorescences; sepals yellow overlaid with green apically; petals pale yellow hidden in tube; lip golden yellow hidden in tube; substance firm; texture waxy. Awarded for xanthina color."
20162366,"CCM","81","Oakland","August 15, 2016","Cattleya","purpurata","Rose","species","Miriam Rose","None","20162366.jpg","16.0","19.5","2.4","10.0","5.0","10.5","4.0","8.0","2.3","10.4","63","0","23",1,"NA","NA","NA","Sixty-three flowers well-displayed on 23 inflorescences; well-grown 130-cm wide plant in a 38-cm plastic pot; sepals and petals white, slight pink blush centrally on petals; lip dark rose-purple, yellow centrally, veined dark-purple; column white with pink spot above anther cap; substance medium; texture crystalline."
20174162,"HCC","79","Gold Coast Cymbidium Growers Show","April 22, 2017","Cymbidium","Space Tango","Cinnabar","(Cymbidium Enterprise Voyage x Cymbidium Last Tango)","Weegie Caughlan","None","20174162.jpg","6.0","5.5","2.0","4.0","2.2","3.2","2.1","2.8","3.0","3.1","32","1","3",1,"NA","NA","NA","Thirty-two round and slightly cuppy flowers and one bud on three inflorescences; sepals and petals white, striped and heavily suffused maroon; lip white, maroon spots coalescing distally; column white overlaid maroon, anther cap white; substance firm; texture matte."
20194700,"HCC","77","Oakland","January 21, 2019","Paphiopedilum","Liberty Taiwan","Wolf Moon","(Paphiopedilum micranthum x Paphiopedilum hangianum)","John McCallen","None","20194700.jpg","9.7","9.0","3.7","5.1","4.6","6.0","5.1","4.2","3.5","4.0","1","0","1",0,"NA","NA","NA","One slightly cupped flower on one inflorescence; sepals light green, tessellated maroon; petals light green, overlaid and tessellated deep rose, proximally hirsuite; pouch light beige, fine deep rose overlay; staminode bright yellow, dark rose-red spotting; substance firm; texture matte."
20235372,"CCM","86","Sonoma County Orchid Society Show","April 1, 2023","Leptotes","bicolor","Memoria Mark Koch","species","Gold Country Orchids","Lynne Murrell","20235372.jpg","5.0","4.0","0.8","3.5","0.6","2.5","0.9","2.7","1.0","3.4","156","18","37",1,"NA","NA","NA","Approximately one hundred fifty-six flowers and 18 buds on 37 3-cm inflorescences; plant 35cm wide, 25cm high, 96cm circumference, mounted in 13-cm square plastic basket; sepals and petals white; lip white, midlobe overlaid lavendar two-thirds basally, side lobes overlaid pale green; column green; substance firm; texture matte."
20162304,"HCC","77","Pacific Orchid Exposition","February 25, 2016","Paphiopedilum","Macbre","Giant","(Paphiopedilum Voodoo Magic x Paphiopedilum sukhakulii)","Japheth Ko","None","20162304.jpg","16.7","12.0","5.5","6.8","3.3","9.5","3.4","6.9","4.1","5.0","1","0","1",0,"NA","NA","NA","One fairly flat flower on one inflorescence; dorsal sepal cream, veins green overlaid mahogany; petals light green heavily spotted mahogany; pouch light mahogany; staminode green; substance medium; texture matte; horizontal stance of petals results in a larger natural spread."
20255350,"HCC","77","San Francisco","January 7, 2025","Cymbidium","goeringii","Pink Lady","species","Amy and Ken Jacobsen","Ken Jacobsen","20255350.jpg","5.5","4.8","0.9","3.4","1.1","2.5","0.9","1.4","0.8","3.2","1","2","3",1,"NA","NA","NA","One flower and two buds on three upright up-to 14-cm inflorescences; sepals lanceolate, dusty rose, veined darker rose; petals porrect, dusty rose coalescing to solid maroon basally; lip recurved, white striped maroon longitudinally; substance firm; texture matte."
20152295,"HCC","79","Peninsula Orchid Society Show","January 23, 2015","Lycaste","Chita Prince","Redwood","(Lycaste Chita Sunset x Lycaste Cherish)","Cal-Orchid","None","20152295.jpg","14.7","13.1","5.5","7.1","5.0","5.2","1.9","3.7","5.6","7.3","1","1","2 ",1,"NA","NA","NA","One flower and one bud on two inflorescences; sepals deep rose; petals red-rose; lip red, yellow callus, mid-lobe white heavily overlaid red; substance firm; texture matte. Flower slightly damaged in transit."
20245365,"CCM","86","Pacific Orchid Exposition","February 15, 2024","Coelogyne","yuccifolia","Sasha","species","Lynne Murrell","Ken Jacobsen","20245365.jpg","1.5","1.2","0.1","0.8","0.1","0.6","0.1","0.2","0.1","0.9","4,056","0","104",1,"NA","NA","NA","Approximately 4,056 stellate flowers and buds on 104 arching, up to 14-cm, evenly distributed inflorescences; well-grown plant 64 cm x  50 cm in 22-cm x 12-cm plastic pot; flowers cream;    substance medium; texture matte."
20245400,"AM","85","National Cheng Kung University Fall Orchid Show, Taiwan","November 5, 2024","Phalaenopsis","Princess Ai","Lungting A133","(Phalaenopsis Ming-Hsing Eagle x Phalaenopsis Sogo Yukidian)","Lung Ting Life Sciences Co., Ltd.","None","20245400.jpg","13.8","12.0","5.5","6.8","8.9","6.9","2.4","3.3","4.4","6.4","9","2","1",1,"NA","NA","NA","Nine flowers and two buds on one 84-cm arching inflorescence; sepals and petals white overlaid shell pink, petals almost touching; lip white, burgundy stripes at base, midlobe white overlaid yellow center and edge, burned orange basally, side lobes white overlaid yellow edge, callus yellow, speckled burgundy; anther cap white; substance firm; texture crystalline."
20194868,"HCC","78","Filoli Historic House","April 20, 2019","Laelia","jongheana","Bentley","species","Amy and Ken Jacobsen","None","20194868.jpg","14.0","12.0","2.0","7.0","3.2","7.3","2.0","5.8","2.0","8.0","2","0","2",1,"NA","NA","NA","Two flowers on two inflorescences; sepals and petals white; lip white, yellow basally to end of side lobes, side lobes bright yellow, keels yellow-orange; anther cap yellow; substance firm; texture crystalline."
20152362,"AM","84","Pacific Orchid Exposition","February 19, 2015","Phragmipedium","besseae","LangKo","species","Japheth Ko and Chaunie Langland","None","20152362.jpg","8.5","6.0","2.2","3.5","3.2","4.3","1.9","4.0","2.0","3.0","1","2","1",0,"NA","NA","NA","One flower and two buds on one inflorescence; dorsal sepal vibrant orange-red; synsepal yellow-green; petals vibrant orange-red, cream proximally; pouch yellow heavily suffused orange-red, yellow at rim; substance firm; texture velvet."
20205400,"AM","85","Filoli Historic House","January 18, 2020","Cymbidium","tortisepalum","Xingyi 456","species","Amy and Ken Jacobsen","None","20205400.jpg","8.8","7.5","1.1","4.6","1.4","3.7","1.2","2.9","1.3","5.0","4","0","1",1,"NA","NA","NA","Four overall flat lily form flowers on one erect 40.0-cm inflorescence; sepals chartreuse blushed maroon, veined maroon, mid-vein darker maroon;  petals porrect, chartreuse blushed maroon along margins, veined maroon, mid-vein darker maroon; lip cream, side lobes overlaid light burgundy, centrally spotted burgundy, crest yellow distally; column light green, darker marginally, ventral surface blotched burgundy, anther cap cream;  substance firm; texture satiny, lip matte."
20215334,"AM","81","Filoli Historic House","September 18, 2021","Catasetum","Dark Odyssey","David Michael","(Catasetum Karen Armstrong x Catasetum Darkness)","Chaunie Langland","Chaunie Langland","20215334.jpg","8.7","6.1","1.5","3.9","2.1","3.9","6.0","3.6","1.8","4.2","10","0","1",1,"NA","NA","NA","Ten male flowers on one 28-cm inflorescence; sepals lanceolate, burgundy, white picatee; petals dark burgundy, overlapping dorsal sepal;  lip cupped, intense dark burgundy, speckled white centrally, waxy texture; column dark burgundy, anther cap ivory, triggers white; substance firm; texture matte."
20235352,"AM","80","Pacific Orchid Exposition","February 23, 2023","Oncidium","San Francisco Goldmine","Cavalier","(Oncidium Tiger Hamb&#252hren x Oncidium Jubilee Volunteer)","Jason Douglas and Ron Norris","Ken Jacobsen ","20235352.jpg","8.6","9.3","2.7","4.5","3.2","4.5","2.9","4.1","2.7","4.7","17","0","1",1,"NA","NA","NA","Seventeen flowers on one staked, branching, 114-cm inflorescence; sepals and petals margins undulate, yellow, random faint cordovan spots, heavily blotched cordovan centrally; lip yellow, lighter yellow distally, mid lobe blotched cordovan, callus dark yellow; column light yellow, anther cap light cordovan; substance firm; texture matte."
20205305,"AM","81","Pacific Orchid Exposition","February 20, 2020","Cattleya","Petitfleur","Gracie","(Cattleya jongheana x Cattleya praestans)","Amy and Ken Jacobsen","None","20205305.jpg","13.0","13.2","2.0","7.3","4.2","7.2","3.4","6.1","2.3","7.0","5","3","5",1,"NA","NA","NA","Five flat flowers and three buds on five inflorescences; sepals and petals deep rose-pink; lip deep rose-pink overlaid deep amethyst distal edge; substance firm; texture diamond dust."
20185466,"AM","84","NCKU 87th Anniversary, Taiwan","November 12, 2018","Phalaenopsis","Lin's Genki","FM 5030","(Phalaenopsis Sogo Genki x Phalaenopsis Leopard Prince)","Fang Mei Orchids","None","20185466.jpg","12.0","8.1","2.6","4.8","3.6","6.1","3.3","6.7","3.3","4.2","1","1","1",0,"NA","NA","NA","Nine very round and overlapping French Spot flowers and three buds arranged well on one arched 82cm inflorescence; sepals and petals white basally overlaid pink with very fine fuchsia pink spots, heavier centrally; lip side lobes white veined with red centrally, yellow distally, midlobe white with fuchsia pink and yellow blotching, calli yellow overlaid with fuchsia pink spots; column white overlaid with fuchsia pink; substance firm; texture crystalline."
20194803,"HCC","76","Sonoma County Orchid Society Show","March 30, 2019","Sarcochilus","Kulnura Lemon","Memoria Ellen Margron","(Sarcochilus Parma x Sarcochilus Roberta)","Cynthia Battershall","None","20194803.jpg","2.7","2.8","1.2","1.6","0.8","1.4","0.5","0.4","1.1","1.7","15","4","3",1,"NA","NA","NA","Fifteen flowers and four buds on three inflorescences; flowers light yellow, faintly spotted and barred darker yellow; sacate lip yellow, side lobes barred orange; substance average; texture matte."
20194810,"CCM","82","San Francisco","May 7, 2019","Sarcochilus","Kulnura Pixie","Gracie","(Sarcochilus Kirra-lea x Sarcochilus Elegance)","Amy and Ken Jacobsen","None","20194810.jpg","2.6","2.4","1.3","1.7","0.9","1.1","0.7","0.6","1.2","1.6","126","94","15",1,"NA","NA","NA","One hundred twenty-six flowers and 94 buds on 15 mature inflorescences and two immature upright inflorescences; plant 43cm wide, grown in a 15-cm pot; sepals and petals white, irregular deep rose markings proximally; lip yellow, rose markings; substance moderately firm; texture crystalline."
20235377,"FCC","91","Santa Clara Valley OS Outreach","May 3, 2023","Cattleya","schilleriana","Mona Lisa","species","Amy and Ken Jacobsen","Chaunie Langland","20235377.jpg","12.5","12.5","2.9","7.3","3.3","7.1","5.7","7.0","2.7","6.1","5","0","1",1,"NA","NA","NA","Five large, stunning flowers arranged evenly on one 12.5-cm inflorescence; sepals and petals slightly undulate, olive green heavily overlaid cordovan, spotted darker cordovan distal two-thirds, undulate margins; lip cream-white, trilobed, heavily veined dark magenta, mid-lobe broad, fan-shaped, slightly ruffled, throat bright yellow, side lobes closed over column; column white blotched dark magenta; substance firm; texture satiny; commended for size and floriferousness."
20225348,"HCC","79","Filoli Historic House Monthly","October 15, 2022","Rhyncholaeliocattleya","Vicky Gold","Forever 16","(Rhyncholaeliocattleya Waikiki Gold x Rhyncholaeliocattleya Vicky Nazareno)","Amy and Ken Jacobsen","Chaunie Langland","None","13.4","13.5","2.0","8.3","4.0","8.1","5.0","5.0","2.4","8.0","6","1","1",1,"NA","NA","NA","Six extremely fragrant flowers and one bud on one 13-cm semi-pendant inflorescence; sepals and petals light yellow-green, petals faint pink venation; lip ruffled, white, symetrical dark pink areas each side, darker pink veins, seperated by light yellow central region, throat overlaid bright yellow; substance firm; texture matte."
20235361,"HCC","77","Pacific Orchid Exposition","February 23, 2023","Masdevallia","Flamenco","Carmen","(Masdevallia Pixie Snow Leopard x Masdevallia John Leathers)","John Leathers","Ken Jacobsen ","20235361.jpg","6.0","12.1","1.7","7.7","0.1","0.3","Minute","Minute","2.1","7.1","1","1","2",1,"NA","NA","NA","One attractive flower and one bud on two 36-cm inflorescences;    dorsal sepal white, caudae 4.5cm, orange tip; lateral sepals white blushed raspberry pink veined darker, dark pink-red linear markings proximally, straight caudae 3.5cm, orange tips; petals minute, white; lip minute, white tipped gold; column and anther cap white; substance firm; texture matte; caudae length included in sepal length measurement."
20225330,"AM","85","Filoli Historic House","May 21, 2022","Phragmipedium","Frank Smith","Not a Dragon","(Phragmipedium Grande 'Crystelle' x Phragmipedium kovachii)","Chaunie Langland","Chaunie Langland","None","7.9","20.0","4.1","9.4","1.8","22.0","3.5","6.5","5.2","8.2","2","3","2",0,"NA","NA","NA","Two dangling flowers and three buds on two inflorescences up to 62cm; dorsal sepal completely recurved into a tube, barely visible white background overlaid rose except basally; synsepal white marked marginally rose, more pronounced at the midrib and margin; petals twisted one quarter turn, white mostly overlaid rose, lighter at the lower margin; pouch full, white blushed rose frontally, spotted purple, sparse rose blothching internally; staminode hirsute, white overlaid rose, more strongly at margin; substance firm; texture matte."
20194705,"AM","81","Peninsula Orchid Society Show","January 25, 2019","Zygopetalum","Mishima Goddess","Midnight","(Zygopetalum B. G. White x Zygopetalum James Strauss)","Weegie Caughlan","None","20194705.jpg","6.0","6.0","2.0","2.3","1.5","2.5","3.5","2.6","2.2","3.0","5","0","1",1,"NA","NA","NA","Five flowers on one inflorescence; sepals and petals chartreuse heavily blotched dark mahogany; lip white, overlaid purple waterfall;  substance very firm; texture matte."
20194873,"AM","82","Filoli","June 15, 2019","Phalaenopsis","bellina v. alba","St. Clair","species","Jim Heilig","None","20194873.jpg","3.6","3.7","1.2","1.9","1.2","1.7","0.8","1.6","1.3","1.9","1","0","1",1,"NA","NA","NA","One shapely flower on one inflorescence; sepals cream, shading to green at distal third; petals cream, shading to green distally; lip white, sidelobes yellow; column and anther cap white; substance heavy; texture matte."
20152335,"AM","80","Gold Coast Cymbidium Growers Show","April 17, 2015","Cymbidium","Alida Valli","Epigarden","(Cymbidium Phar Lap x Cymbidium Rio Rita)","Weegie Caughlan","None","20152335.jpg","6.5","6.0","2.1","4.0","1.7","3.5","1.7","2.4","2.2","3.5","43","6","1",1,"NA","NA","NA","Forty-three flowers and six buds on a single arching pendant inflorescence; sepals and petals maroon with darker midline and cream edge; lip saturated ruby, keel cream; pollen cap white; substance firm; texture matte."
20225315,"HCC","78","Filoli Historic House","April 16, 2022","Cattleya","intermedia","Impressive One","species","Amy and Ken Jacobsen","Chaunie Langland","None","10.5","10.0","2","6","3","5.7","3.7","5","3","4.5","5","0","1",1,"NA","NA","NA","Five flowers on one 12-cm upright inflorescence; sepals lanceolate, white marked green at the tip; petals white overlaid light purple on the edge and dark purple on the distal half; lip strongly frilled at the central margin, side lobes partially closed over the column, white, strongly marked purple at the margins; column white mostly overlaid purple, anther cap white, substance firm; texture matte."
