"awardnum","award","awardpoints","location","datevalue","genus","species","clone","crossvalue","exhibitor","photographer","awardphoto","nsnum","nsvnum","dswnum","dslnum","petwnum","petlnum","lipwnum","liplnum","lswnum","lslnum","numflwrs","numbuds","numinfl","measurementtype","inflen","plantW","plantH","description"
20225407,"AM","82","Pacific Orchid Exposition","February 24, 2022","Cattleya","Love Knot","Blue Moon","(Cattleya sincorana f. coerulea 'SVO' x Cattleya walkeriana f. coerulea 'Wenzell Son')","Sunset Valley Orchids","Ken Jacobsen","20225407.jpg","10.5","11.0","1.8","5.5","4.0","6.0","3.5","5.0","2.2","6.0","2","0","1",1,"NA","NA","NA","Two flat flowers on one 4.0-cm inflorescence; sepals and petals light lavender; lip white, distal half including side lobes lavender, dark lavender veins, light yellow centrally; column white blushed light lavender; substance firm; texture diamond dust."
20235302,"AM","80","Filoli Historic House","September 16, 2023","Paphiopedilum","Night Song","Burgundy Max","(Paphiopedilum Macabre x Paphiopedilum King Charles)","Tom Merics","Chaunie Langland","20235302.jpg","10.0","9.1","5.6","4.7","2.2","5.6","2.6","5.0","2.7","3.4","1","0","1",0,"NA","NA","NA","One round flower on one upright unsupported 14-cm inflorescence;  dorsal sepal white, veined dark burgundy, overlaid dark burgundy basally; synsepal chartreuse, striped dark chartreuse; petals lightly ruffled, chartruse overlaid dark burgundy; pouch chartrause heavily overlaid dark burgundy; staminode cream, blushed pink distally, dark green spot centrally; substance medium; texture lacquer; commended for brilliant color."
20205317,"HCC","76","Pacific Orchid Exposition","February 20, 2020","Paphiopedilum","dayanum","Tiny Jungle Champ","species","Chris Mende","None","20205317.jpg","14.1","12.5","4.0","6.0","1.7","7.9","3.1","6.1","2.1","5.1","1","0","1",0,"NA","NA","NA","One flower  on one 19.2-cm inflorescence; sepals cream, flushed and veined dark green; hirsute petals cream, green centrally, flushed and veined mahogany fading apically; pouch green, heavily flushed dark mahogany; staminode dark green, darker green veins centrally; substance thick; texture hirsute."
20235292,"HCC","76","Filoli Historic House","June 17, 2023","Angreacum","didieri","Lapeer","species","Jim Heilig","Chaunie Langland","20235292.jpg","9.1","6.4","1.1","5.2","0.6","4.7","2.7","4.2","1.1","4.7","1","0","1",1,"NA","NA","NA","One flower on one 0.5-cm inflorescence; flower white; lip spatulate, nectary pale green, 15cm; substance firm; texture crystalline."
20225325,"HCC","76","Filoli Historic House","April 16, 2022","Cymbidium","unregistered hybrid","Elkhorn","(Cymbidium Fifi x Cymbidium schroederi)","Andy Cameron","Chaunie Langland","20225325.jpg","7.0","6.0","1.9","4.0","1.5","4.2","2.3","5.5","2.0","4.2","25","7","2",1,"NA","NA","NA","Twenty-five flowers and seven buds on two arching infloresences up to 72cm long; sepals and petals yellow-green overlaid bronze in veinated pattern; lip bright yellow spotted red; column yellow suffused rose, distally speckled rose ventrally, anther cap white; substance firm; texture matte."
20235299,"AM","83","Filoli Historic House","July 15, 2023","Maxillaria","tenuifolia","Mason's","species","Japheth Ko","Chaunie Langland","20235299.jpg","4.9","3.8","1.1","2.9","0.7","2.9","1.2","2.0","0.9","2.8","6","0","6",1,"NA","NA","NA","Six flowers on six 0.5-cm inflorescences;  sepals acuminate, burgundy, green tips and abaxial surface ; petals acuminate, porrect, burgundy, green tips and abaxial surface; lip cream, heavily overlaid burgundy blotches basal two-thirds, less on apical one-third; column light green overlaid burgundy, anther cap light green; substance impressively firm; texture matte; unusually long 5.0cm pedicel; fragrance light coconut, citrus component atypical, identity verified by SITF."
20194851,"AM","80","Filoli","January 12, 2019","Cattleya","Lake Tahoe","Echo Valley","(Cattleya Floralia's Azul x Cattleya sincorana)","Echo Valley Orchids","None","20194851.jpg","10.0","10.0","2.1","6.0","4.2","6.0","3.7","4.9","2.0","6.4","2","1","2",1,"NA","NA","NA","Two full, slightly concave flowers and one bud on two inflorescences on a well grown plant; sepals and petals blue-lavender; lip cream, overlaid blue-lavender sidelobes, purple midlobe; column and anther cap cream;  substance firm; texture matte."
20162361,"HCC","79","Oakland","May 16, 2016","Phalaenopsis","Phoenix Sunflower","Shadow","(Phaleanopsis I-Hsin Sunflower  x Phalaenopsis Hawaii Sun)","Eric Goo/Phoenix Orchids","None","20162361.jpg","6.9","6.5","2.8","3.1","3.6","3.4","1.3","2.4","2.2","3.0","9","0","1",1,"NA","NA","NA","Nine flowers on one branched inflorescence; sepals and petals white overlaid yellow with darker yellow spots centrally, petal margins darker yellow; lip white, yellow-orange medially, side lobes yellow; substance firm; texture matte."
20225257,"AM","80","San Francisco","April 5, 2022","Cymbidium","Darrel Wong","Tangerine","(Cymbidium Lambert Day x Cymbidium Karen Hawaiian)","Pierre Pujol","Ken Jacobsen","20225257.jpg","6.8","6.0","2.5","5.3","2.1","4.5","2.2","3.2","2.5","4.3","68","0","3",1,"NA","NA","NA","Sixty-eight flowers on three 70-cm arching inflorescences; sepals yellow overlaid light red, stronger apically; petals yellow overlaid light red, stronger medially; lip bright yellow blotched red, darker orange-red bar distally on midlobe; column yellow overlaid red, anther cap white; substance firm; texture matte."
20185418,"HCC","78","San Francisco","September 4, 2018","Habenaria","Pegasus","Rick Stier","(Habenaria medusa x Habenaria carnea)","Jim Heilig","None","20185418.jpg","4.0","2.8","0.5","0.9","0.1","0.3","4.0","2.3","0.8","0.9","9","7","1",1,"NA","NA","NA","Nine flowers and seven buds on one infloresence; dorsal sepal light olive green; lateral sepals light mauve-pink; petals off-white; lip white blushed pink at base, fringed,  5.0-cm nectary pink proximally, brown-green distally;  substance fair; texture matte."
20245359,"HCC","78","Pacific Orchid Exposition","February 15, 2024","Dendrobium","Brimbank Fire","Dreaming of You","(Dendrobium Ray's Dream x Dendrobium speciosum)","Sunset Valley Orchids","Ken Jacobsen","20245359.jpg","3.3","5.7","0.8","3.2","0.3","2.8","0.9","1.3","1.0","2.3","83","1","5",1,"NA","NA","NA","Eighty-three flowers and one bud on five up to 29-cm inflorescences; sepals cream overlaid burgundy; petals slightly porrect, cream overlaid burgundy; lip cream, suffused burgundy basally, veined burgundy apically, callus yellow spotted burgundy; column white, anther cap white; substance heavy; texture matte."
20235286,"HCC","79","Filoli Historic House","May 20, 2023","Sarcochilus","Kulnura Class",101,"(Sarcochilus Elegance x Sarcochilus Kulnura Splash)","Amy and Ken Jacobsen","Chaunie Langland","20235286.jpg","3.1","3.3","1.6","1.8","1.0","1.5","0.5","0.6","1.8","1.5","124","3","17",1,"NA","NA","NA","One hundred twenty-four flowers and three buds on 17 up-to 24.5-cm inflorescences, one of those juvenile; sepals and petals dusty rose, darker veins, lighter picotee; lip saccate, white overlaid orange, dark orange markings, lateral lobes dusty rose; substance firm; texture crystalline."
20194878,"HCC","78","Filoli Historic House","July 20, 2019","Cattleya","purpurata","Hot Enough","species","Amy and Ken Jacobsen","None","20194878.jpg","15.0","14.8","2.3","9.0","5.0","8.6","4.2","6.8","2.4","8.8","3","0","1",1,"NA","NA","NA","Three flowers on one inflorescence; sepals cream, flushed magenta; petals cream, richly flushed and lineated magenta; lip richly saturated magenta, darker magenta lineation, well defined throat light yellow, nicely lineated magenta; column cream, lightly flushed magenta; substance firm; texture matte."
20174158,"FCC","92","Gold Coast Cymbidium Growers Show","April 22, 2017","Sarcochilus","Fiery Twin","Fran Weaver","(Sarcochilus Fiery Glow x Sarcochilus Duno Nicky's Twin)","Bill Weaver","None","20174158.jpg","2.5","3.6","1.1","1.3","0.9","1.3","0.6","1.0","1.0","1.9","57","3","9",1,"NA","NA","NA","Fifty-seven flowers and three buds on nine inflorescences; sepals and petals bold and evenly saturated crimson red; lip yellow, finely spotted orange, lateral lobes spotted crimson; column and anther cap ivory; substance firm; texture velvety."
20205315,"AM","83","San Francisco","March 3, 2020","Cymbidium","Mini-Me","Woodside","(Cymbidium Kirby Lesh x Cymbidium Vogel's Magic)","Pierre Pujol","None","20205315.jpg","7.4","6.2","2.4","5.0","2.1","4.2","3.3","3.7","3.0","4.7","19","0","1",1,"NA","NA","NA","Nineteen flowers on one arching 76-cm inflorescence; sepals and petals pink, speckled dark burgundy, spotted densely at midline; lip cream, flushed light burgundy at margins, dark burgundy at apex, callus yellow, marked dark burgundy; column white, flushed and spotted pink, anther cap yellow; substance hard; texture matte."
20194865,"CCE","91","Gold Coast Cymbidium Growers Show","April 13, 2019","Microcoelia","stolzii","Kathy Fenwick's Medusa","species","Margaret and Terry Boomer","None","20194865.jpg","0.3","0.4","0.2","0.3","0.2","0.3","0.1","0.3","0.2","0.3","1700","440","60",1,"NA","NA","NA","Approximately one thousand seven hundred flowers and approximately 440 buds on 60 arching inflorescences; 25-cm diameter plant mounted on an inverted 7-cm square basket; flowers white; anther cap  yellow-orange; substance firm; texture crystalline."
20235300,"HCC","77","Filoli Historic House","July 15, 2023","Cattleya","warscewiczii","Thomas Toulemonde","species","Steven Christoffersen","Chaunie Langland","20235300.jpg","18.0","18.2","2.9","12.7","5.9","10.8","5.9","9.2","2.9","9.8","2","0","1",1,"NA","NA","NA","Two flowers on one  13.5-cm inflorescence;  sepals and petals dark pink, cream basal attachment area, petals pronounced midrib, slightly ruffled; lip ruffled, closed over column, cream heavily overlaid purple, throat yellow overlaid purple, yellow veins, small cream eyes; substance firm; texture light diamond dust."
20245300,"HCC","76","Filoli Historic House","September 21, 2024","Paphiopedilum","wenshanense","SS Xuan's Surprise","species","Evan Shen","Chaunie Langland","20245300.jpg","5.3","6.2","3.7","3.1","3.1","4.3","1.9","3.5","2.6","2.4","1","0","1",0,"NA","NA","NA","One flower, pale yellow, on one 3.5-cm inflorescence; sepals spotted chocolate basally; petals spotted chocolate; lip speckled chocolate; staminode stippled chocolate; substance medium; texture waxy."
20225312,"HCC","75","Filoli Historic House","April 16, 2022","Sarcochilus","Kulnura Harrow","Pink Contrast","(Sarcochilus Kulnura Rusty x Sarcochilus Kulnura Rosetta)","Pierre Pujol","Chaunie Langland","None","2.6","2.7","1.0","1.2","0.8","1.1","0.5","0.4","1.0","1.4","95","115","16",1,"NA","NA","NA","Ninety-five flowers and 115 buds on 16 upright inflorescences up to 16cm in length; petals and sepals white, barred dark rose basally, irregularly spotted pale rose distally: lip bright yellow, orange blotches; anther cap white; substance firm; texture crystalline."
20185465,"HCC","78","NCKU 87th Anniversary, Taiwan","November 12, 2018","Phalaenopsis","Fangmei Dream Lip","FM 7136","(Phalaenopsis Fangmei Dream Wedding x Phalaenopsis Fangmei Black Piano)","Fang Mei Orchids","None","20185465.jpg","12.0","8.1","2.6","4.8","3.6","6.1","3.3","6.7","3.3","4.2","1","1","1",0,"NA","NA","NA","Ten flowers and one bud on one arching 90cm inflorescence; sepals and petals white overlaid with cherry blossom pink, lightly veined centrally and distally with darker cherry blossom pink; lip side lobes and midlobe cherry blossom pink, ocher yellow centrally with maroon spots basally, calli ochre yellow dotted with maroon; column white overlaid with cherry blossom pink; substance very firm; texture crystalline."
20215309,"HCC","76","Filoli Historic House","April 17, 2021","Sarcochilus","Kulnura Treasure","Bentley","(Sarcochilus Kulnura Festival x Sarcochilus Dragonfly)","Amy & Ken Jacobsen","None","20215309.jpg","2.8","2.5","1.0","1.3","0.9","1.3","0.5","0.4","1.1","1.4","24","34","6",1,"NA","NA","NA","Twenty-four slightly cupped flowers and 34 buds on six inflorescences, plus four immature inflorescences; sepals and petals pure white overlaid dark rose proximally creating a central ring; saccate lip yellow, tip orange; substance firm; texture crystalline."
20152292,"AM","82","Peninsula Orchid Society Show","January 23, 2015","Epidendrum","Pacific Peacock","Fuschia","(Epidendrum Pacific Smoothie x Epidendrum Pacific Mulberry)","Cal-Orchid, Inc.","None","20152292.jpg","4.4","5.0","1.4","2.2","1.6","2.0","2.6","2.5","0.9","2.3","18","15","1",1,"NA","NA","NA","Eighteen flowers and fifteen buds on one inflorescence; sepals and petals saturated dark fuchsia; lip dark fuchsia, light yellow keels, column red-magenta, anther cap pale green; substance average; texture matte."
20245250,"CCM","83","Filoli Historic House","January 20, 2024","Cattleya","coccinea","Robert Clair","species","Diane Bond","Chaunie Langland","20245250.jpg","6.2","5.3","1.6","2.8","3.2","2.9","0.8","2.3","1.3","2.7","19","1","20",1,"NA","NA","NA","Nineteen full flowers and one bud on 20 up to 2.5-cm inflorescences; plant 31 cm x 27 cm on a 13-cm x 17-cm cork mount;  sepals and petals intense orange-red; lip enclosed, yellow heavily overlaid orange-red, throat centrally striated orange-red; column white; substance firm; texture crystalline."
20225336,"AM","81","Filoli Historic House","June 18, 2022","Vanda","Paki","Teri","(Vanda cristata x Vanda tricolor var. suavis)","Sylvia Darr","Chaunie Langland","None","6.0","5.7","1.3","3.5","0.8","3.1","1.4","3.0","1.5","2.7","6","3","1",1,"NA","NA","NA","Six star-shaped flowers and three buds on one 16-cm cut inflorescence; sepals and petals light chartreuse, speckled maroon, petals rotated 90 degrees downward; lip light chartreuse, overlaid bright maroon, creating longitudinal cream stripes; anther cap light yellow; substance firm; texture matte."
20225306,"AM","80","Filoli Historic House Monthly","March 19, 2022","Cymbidium","Equinox","Mellow Yellow","(Cymbidium Shirley May Walker x Cymbidium Bill Bailey)","Weegie Caughlan","Chaunie Langland","None","10.7","8.0","4.0","6.8","3.4","5.6","3.3","4.1","4.0","5.6","25","2","2",1,"NA","NA","NA","Twenty five slightly cupped full flowers and two buds on two 85.5-cm  inflorescences; sepals and petals clear pastel yellow; lip white, marked medially in yellow, keels white overlaid yellow; column yellow, marked darker yellow interiorly, anther cap cream; substance hard; texture matte."
20185556,"AM","86","Pacific Orchid and Garden Exposition","February 22, 2018","Paphiopedilum","Robinianum","Tiny Jungle","(Paphiopedilum lowii x Paphiopedilum parishii)","Chris Mende","None","20185556.jpg","10.4","15.2","4.0","5.3","1.4","12.2","2.5","5.6","3.0","5.7","8","4","2",0,"NA","NA","NA","Four flowers and four buds on two inflorescences; dorsal sepal chartreuse, veined darker chartreuse, mid-line dark rose, green proximally; synsepal chartreuse, fine veins rose; petals glowing chartreuse, spotted dark maroon proximally, suffused dark rose distal two-thirds; pouch rose, dark rose proximally; staminode cream, dark green centrally; substance good, pouch heavy; texture matte, pouch glossy."
20205403,"HCC","78","Filoli Historic House","February 15, 2020","Paphiopedilum","Big Thunder","Monterey Bay","(Paphiopedilum Big Smile x Paphiopedilum Thunder World)","Echo Valley Orchids","None","20205403.jpg","12.5","10.4","11.0","7.3","5.6","7.0","3.4","5.4","8.6","7.0","1","0","1",0,"NA","NA","NA","One flower on one 25.5-cm inflorescence;  sepals white, yellow-green centrally, heavy distinct dark burgundy spots;  petals yellow-green, few spots apically, overlaid cordovan; pouch yellow-green, heavily overlaid dark cordovan;  substance firm; texture waxy."
20162306,"HCC","77","Pacific Orchid Exposition","February 25, 2016","Cymbidium","Joseph Schmidt","Monster","(Cymbidium Canal Parish x Cymbidium sinense)","Ramon de los Santos","None","20162306.jpg","5.0","5.5","1.0","3.3","1.2","2.8","1.5","1.5","1.0","3.2","72","3","6",1,"NA","NA","NA","Seventy-two scented, well- spaced flowers and three buds on six inflorescences; sepals pale yellow, overlaid and striped mahogany, margins remain pale yellow; petals pale yellow, overlaid and striped mahogany, speckles coalesce into stripes superiorly, margins remain pale yellow; lip light cream heavily spotted dark mahogany, margins solid dark mahogany; column striped and spotted dark mahogany; substance firm; texture matte."
20215322,"HCC","78","Filoli Historic House","June 19, 2021","Cattleya","Philip Streeter","Pink Plate","(Cattleya loddigesii x Cattleya Mari's Song)","Any and Ken Jacobsen","None","20215322.jpg","10.6","10.8","2.8","7.2","4.9","6.0","4.9","5.4","2.6","6.4","3","0","1",1,"NA","NA","NA","Three closely arranged flowers on one upright inflorescence; sepals medium lavender; petals spatulate, slightly undulate and dentiuclate, medium lavender, close purple spotting on midrib; lip broadly flared, undulate and denticulate, lavender, strong purple triangular splash apically, white throat; column bulbous, white; substance very firm; texture matte."
20235287,"CCM","84","Filoli Historic House","May 20, 2023","Sarcochilus","Red Hot Kiss","Opportunity","(Sarcochilus Rosella 'Multi' x Sarcochilus Kulnura Intensity 'Mottle Base')","Chaunie Langland","Chaunie Langland","20235287.jpg","2.4","2.4","0.9","1.3","0.6","1.2","0.3","0.4","0.9","1.3","322","6","23",1,"NA","NA","NA","Three hundred twenty-two flowers and six buds on 23 up-to 15-cm inflorescences; well displayed around a cleanly grown 38-cm wide x 23-cm tall plant grown in bark in a 10-cm plastic pot; sepals and petals cream white overlaid pink, blotched dark rose; lip saccate, yellow, rose band at midpoint; anther cap white; substance avearage; texture diamond dust; commended for excellent culture in a small pot."
20194856,"AM","83","Filoli Historic House","March 9, 2019","Cymbidium","goeringii","Tristan","species","Amy and Ken Jacobsen","None","20194856.jpg","4.8","4.0","1.6","3.0","1.5","2.4","1.5","1.9","1.6","3.0","2","1","3",1,"NA","NA","NA","Two flowers and one bud on three inflorescences; sepals clear green, maron stripe basally;  petals porrect, clear green, very pale maroon stipes proximally, separate dark maroon stripes basally; lip cream, maroon spots; anther cap cream; substance firm; texture matte."
20194808,"HCC","75","San Francisco","May 7, 2019","Disa","tripetaloides","Wally Orchid","species","Chen-Hao Hsu","None","20194808.jpg","2.3","2.4","1.2","1.5","0.2","0.5","0.2","0.4","1.0","1.6","6","11","1",1,"NA","NA","NA","Six flowers and 11 buds on one inflorescence; hooded dorsal sepal white, faint pink spots interior; lateral sepals white; small petals yellow, curved and overlapping over column, under hooded dorsal sepal; lip white, yellow distally, blushed pink proximally; substance firm; texture crystalline."
20152368,"HCC","75","Oakland","April 20, 2015","Masdevallia","Barbara Cook","Gypsy","(Masd. Patricia Hill x Masd. Fraseri)","Ken Cook","None","20152368.jpg","3.9","8.3","1.4","5.8","NM","NM","NM","NM","2.1","5.8","4","0","4",1,"NA","NA","NA","Four symmetrical flowers on four upright inflorescences; dorsal sepal red-orange fading to rich yellow in throat; lateral sepals red-orange, red apically, caudae dark red; petals white; lip white, purple proximally; substance firm; texture matte."
20162321,"HCC","78","Sonoma County Orchid Society Show","April 2, 2016","Paphiopedilum","glaucophyllum","Bailey's Best","species","Susan Anderson","None","20162321.jpg","8.1","7.2","4.1","3.1","1.2","4.9","2.3","3.9","2.7","2.4","2","2","2",0,"NA","NA","NA","Two flowers and two buds on two inflorescences; dorsal sepal bright green bordered ivory, overlaid and veined chestnut brown; hirsute petals ivory, spotted burgundy with pink overlay distally; pouch pale yellow, overlaid pink;  staminode chartreuse, overlaid burgundy ; substance firm; texture glossy."
20245260,"HCC","75","Filoli Historic House","March 16, 2024","Angraecum","elephantinum","Gogebec","species","Jim Heilig","Chaunie Langland","20245260.jpg","8.3","9.4","0.7","5.3","0.5","4.2","1.8","4.0","0.6","5.3","1","0","1",1,"NA","NA","NA","One stellate flower on one 4.4-cm inflorescence; flower off-white, green basally; 14.5-cm spur curved, light green; column green; substance firm; texture crystalline."
20185454,"AM","84","San Francisco","November 6, 2018","Phragmipedium","Yelva Myhre","Oxblood","(Phragmipedium kovachii x Phragmipedium Rosalie Dixler)","John McCallen","None","20185454.jpg","12.0","8.1","2.6","4.8","3.6","6.1","3.3","6.7","3.3","4.2","1","1","1",0,"NA","NA","NA","One flower and one bud on one inflorescence; dorsal sepal pink-burgundy; lateral sepal green overlaid pink-burgundy; petals pink-burgundy; pouch pink-burgundy, darker spotting on rim and interior;  substance firm; texture velvet."
20152363,"CBR","NA","Pacific Orchid Exposition","February 19, 2015","Paphiopedilum","parnatanum","Skittles","species","Michael Fong","None","20152363.jpg","8.5","8.2","3.3","4.1","1.8","6.1","2.3","5.0","1.8","3.1","1","0","1",0,"NA","NA","NA","One flower on one arching inflorescence; foliage mottled, 14.5 cm long x 3.0 cm wide; dorsal sepal white, veined green, purple suffusion laterally; petals light green with green veins, spots suffused brown; synsepal marked same as dorsal; pouch light green, veined green, brown-pink suffusion at apex and about staminode; staminode horseshoe shaped, light green with green veins centrally; substance light; texture glossy. Recognized for seldom seen species."
20185404,"HCC","75","San Fransisco","May 1, 2018","Cattleya","Little Red Seagull","Gracie","(Cattleya coccinea x Cattleya rupestris)","Amy and Ken Jacobsen","None","20185404.jpg","6.3","5.6","1.2","3.3","1.8","3.0","0.9","2.6","1.2","3.4","13","5","7",1,"NA","NA","NA","Thirteen flowers and five buds on seven inflorescences; sepals and petals cerise; lip dark cerise, veined on lobes, throat yellow; substance medium; texture crystalline."
20225424,"AM","80","Peninsula Orchid Society Show","May 8, 2022","Cymbidium","Ken Jacobsen","Woodside","(Cymbidium Memoria Amelia Earhart 'Geyserland' x Cymbidium Woody Wilson 'Ann')","Pierre Pujol","Japheth Ko","20225424.jpg","8.3","8.2","4.1","5.9","3.4","6.0","3.7","4.0","4.0","5.9","13","0","1",1,"NA","NA","NA","Thirteen slightly cupped flowers on one arching 53-cm inflorescence;  dorsal sepal pale yellow, midrib finely spotted light burgundy; lateral sepals pale yellow, veins lightly spotted burgundy; petals pale yellow, midrib finely spotted light burgundy; lip white, sidelobes burgundy at margins, midlobe randomly marked large oxblood spots, centrally dark burgundy stripe, keels yellow; column light magenta, anther cap white; substance firm; texture matte."
20162370,"HCC","75","San Francisco","Sep 6, 2016","Stanhopea","wardii","Tommy","species","Sandra Nesting-Hayes","None","20162370.jpg","8.9","9.3","2.8","6.1","3.5","6.2","3.2","5.1","2.1","5.2","5","6","2",1,"NA","NA","NA","Five flowers on one mature pendent inflorescence and six buds on one immature inflorescence; flowers bright yellow speckled lightly cordovan; dorsal sepal cupped; lateral sepals somewhat rolled; petals twisted and reflexed; hypochile strongly marked very dark mahogany, mesochile orange, epichile yellow very lightly spotted cordovan; substance firm; texture waxy."
20225322,"AM","82","Filoli Historic House","April 16, 2022","Cymbidium","Golden Valley","Cinnabar","(Cymbidium Valley Splash x Cymbidium Tower of Fire)","Weegie Caughlan","Chaunie Langland","20225322.jpg","11.0","9.5","5.0","7.3","4.2","5.9","4.5","4.6","5.2","5.7","18","0","2",1,"NA","NA","NA","Eighteen flowers on two upright staked inflorescences up to 66cm length; sepals and petals yellow blushed dark rose centrally; lip yellow, burgundy blotches distally, midlobes blushed rose marginally; anther cap ivory; substance firm; texture matte."
20162313,"AM","82","Pacific Orchid Exposition","February 25, 2016","Dendrobium","Roy Tokunaga","Hawaiian Gift","(Dendrobium johnsoniae x Dendrobium atrovialaceum)","H&R Nurseries","None","20162313.jpg","8.5","5.6","1.4","3.3","2.6","4.4","1.4","2.8","1.4","3.0","258","19","42",1,"NA","NA","NA","Two-hundred fifty-eight flowers and 19 buds on 42 inflorescences plus six immature inflorescences on an 89-cm wide x 67-cm tall plant in a 27-cm pot; sepals and petals paper white, randomly spotted magenta-purple on the adaxial side, visible on the abaxial side; lip paper white, dark magenta-purple on side lobes dispersing to spots on the mid-lobes; substance firm; texture matte."
20245276,"HCC","79","Peninsula Orchid Society and Gold Coast Cymbidium Society Show","April 27, 2024","Cattleya","jongheana","Celia","species","Anthony Rivera","Chaunie Langland","20245276.jpg","15.0","12.0","2.0","7.9","3.9","7.7","2.5","4.9","2.0","7.1","1","0","1",1,"NA","NA","NA","One fairly flat flower on one 4-cm inflorescence; sepals lanceolate, tips reflexed, lavender-pink, darker medial stripes; petals ovate, lancolate, lavender-pink, darker veins; lip tubular, ruffled edge, white overlaid dark lavender proximally, yellow keel area, keels darker yellow, lavender picotee; column dark lavender, anther cap cream; substance firm; texture crystalline."
20194887,"AQ","NA","Filoli Historic House","November 16, 2019","Paphiopedilum","Fred's Magical Bean","NA","(Paphiopedilum Fred's Moon 'Lehua's Glow' x Paphiopedilum Fred's Magic 'Lightly Peppered')","Lehua Orchids","None","20194887.jpg","NA","NA","NA","NA","NA","NA","NA","NA","NA","NA","NA","NA","NA",1,"NA","NA","NA","Sixteen cut flowers of Paphiopedilum maudiae type recognized for consistent color and shape, petal shape and stance, and pouch form; substance good; texture matte; one grex had received an HCC (20183789) in 2018 and a second, in this AQ group, recieved an AM (20194836)."
